APD ID,Name,Sequence,Source
01135,"Violacin A (natural AMPs; uncyclo-tides, UCSS1a; 3S=S, plants)",SAISCGETCFKFKCYTPRCSCSYPVCK,Viola odorata (Violaceae)
01136,"Tricyclon A (natural AMPs; cyclotides; plants; XXC, 3S=S, UCBB1ab; ZZHp)",GGTIFDCGESCFLGTCYTKGCSCGEWKLCYGTN,"Australian flowers, Viola tricolor"
01139,"Vico A (cyclotides; plants; XXC;  3S=S, UCBB1ab; DXWZ)",GSIPCAESCVYIPCFTGIAGCSCKNKVCYYN,Viola cotyledon
01140,"Vico B (cyclotides; plants; XXC; 3S=S, UCBB1ab; DXWZ)",GSIPCAESCVYIPCITGIAGCSCKNKVCYYN,Viola cotyledon
01143,"Vhr1 (cyclotides; plants; XXC; 3S=S, UCBB1ab; DXWZ)",GIPCAESCVWIPCTVTALLGCSCSNKVCYN,Viola hederacea
01144,"Vitri A (cyclotides; plants; XXC; 3S=S, UCBB1ab; DXWZ)",GIPCGESCVWIPCITSAIGCSCKSKVCYRN,Viola tricolor
01145,"Tricyclon B (cyclotides; plants; XXC; 3S=S, UCBB1ab; DXWZ)",GGTIFDCGESCFLGTCYTKGCSCGEWKLCYGEN,"Australian flowers, Viola tricolor"
01134,"PL-135 (specifically targeted antimicrobial peptides, analog of plicatamide, synthetic, UCLL1)",FHFHLHF,sequence shuffling
01149,"violapeptide 1 (natural AMPs; cyclotides; plants; 3S=S, UCBB1ab; XXC)",GLPVCGETCVGGTCNTPGCSCSRPVCTAN,
01160,"Brazzein (natural AMPs; defensins; UCSS1a; 4S=S, plants)",QDKCKKVYENYPVSKCQLANQCNYDCKLDKHARSGECFYDEKRNLQCICDYCEY,"pulp, fruits, Pentadiplandra brazzeana Baillon"
01162,"EAFP2 (Eucommia antifungal peptide 2, XXQ, natural AMPs; chitin-binding; BBS, 5S=S; UCSS1a; plants)",QTCASRCPRPCNAGLCCSIYGYCGSGAAYCGAGNCRCQCRG,Eucommia ulmoides Oliver
01164,"EAFP1 (Eucommia antifungal peptide 1, natural AMPs;  UCSS1a; 5S=S, XXQ, BBS, plants)",QTCASRCPRPCNAGLCCSIYGYCGSGNAYCGAGNCRCQCRG,Eucommia ulmoides Oliver
01243,"Cy-AMP1 (CyAMP1, natural AMPs; chitin-binding; plants; 4S=S; UCSS1a;  BBS)",KGAPCAKKPCCGPLGHYKVDCSTIPDYPCCSKYGFCGSGPQYCG,"the cycad seeds, Cycas revoluta"
01244,"Cy-AMP2 (CyAMP2, natural AMPs;  plants; 4S=S; UCSS1a;)",KGGPCAKKPCCGPLGHYKVDCSTIPDYPCCSKYGFCGSGPQYCG,"the cycad seeds, Cycas revoluta"
01277,"Viscotoxin A3 (VtA3, thionins; natural AMPs; UCSS1a; plants, BBMm; 3S=S)",KSCCPNTTGRNIYNACRLTGAPRPTCAKLSGCKIISGSTCPSDYPK,"the European mistletoe, Viscum album L"
01245,"Cy-AMP3 (CyAMP3, natural AMPs; plants; 4S=S; UCSS1a)",AVTCNTVVSSLAPCVPFFAGSAAQPTAACCNGVRSLNSAARTTPDRRTACNCIKSSASSIGLNYNKAAKLPSRCTVNVTVPISPSVNCAT,"the cycad seeds, Cycas revoluta"
01278,"Viscotoxin 1-Ps (Vt1-Ps, thionins; natural AMPs; UCSS1a; 3S=S, plants)",KSCCPNTTGRNIYNTCRFGGGSREVCARISGCKIISASTCPSDYPK,"the European mistletoe, Viscum album L"
01279,"Viscotoxin A1 (VtA1,  thionins; natural AMPs;  UCSS1a; 3S=S, plants)",KSCCPNTTGRNIYNTCRLTGSSRETCAKLSGCKIISASTCPSNYPK,"seeds, Viscum album L"
01280,"Viscotoxin C (Viscotoxin C1, VtC1,  thionins; natural AMPs;  UCSS1a; 3S=S, plants)",KSCCPNTTGRNIYNTCRFAGGSRERCAKLSGCKIISASTCPSDYPK,the Asiatic Viscum album ssp Coloratum ohwi
01281,"Viscotoxin A2 (VtA2,  thionins; natural AMPs;  UCSS1a; 3S=S, plants)",KSCCPNTTGRNIYNTCRFGGGSRQVCASLSGCKIISASTCPSDYPK,Viscum album L
01282,"Viscotoxin B (VtB,  thionins; natural AMPs;  UCSS1a; 3S=S, plants)",KSCCPNTTGRNIYNTCRLGGGSRERCASLSGCKIISASTCPSDYPK,Viscum album L
01330,"Vv-AMP1 (Vitis vinifera antimicrobial peptide 1, natural AMPs;  4S=S, defensin; UCSS1a; plants)",RTCESQSHRFKGTCVRQSNCAAVCQTEGFHGGNCRGFRRRCFCTKHC,"berry, Vitis vinifera"
01284,"Viscotoxin B2 (VtB2,  thionins; natural AMPs;  UCSS1a; 3S=S, plants)",KSCCKNTTGRNIYNTCRFAGGSRERCAKLSGCKIISASTCPSDYPK,Viscum coloratum (Kom.) Nakai
01344,"Cn-AMP3 (XXA; C. nucifera antimicrobial peptide 3, natural AMPs; plants)",TCSYTMEA,"green coconut water, Cocos nucife"
01343,"Cn-AMP2 (XXA; C. nucifera antimicrobial peptide 2, natural AMPs;  plants)",TESYFVFSVGM,"green coconut water, Cocos nucife"
01342,"Cn-AMP1 (CnAMP1, XXA; C. nucifera antimicrobial peptide 1, natural AMPs;  plants)",SVAGRAQGM,"green coconut water, Cocos nucifera"
01355,Pg-AMP1  (natural AMPs; Gly-rich; plants),RESPSSRMECYEQAERYGYGGYGGGRYGGGYGSGRGQPVGQGVERSHDDNRNQPR,Psidium guajava
01356,"Cp-thionin II (natural AMPs; UCSS1a; 4S=S, plants, BBMm; Derivative: KT43C)",KTCMTKKEGWGRCLIDTTCAHSCRKYGYMGGKCQGITRRCYCLLNC,"cowpea seeds, Vigna unguiculata"
01469,"WAMP-1a (hevein-like peptide, natural AMPs; UCSS1a; plants;chitin-binding, BBS; 5S=S; UCSS1a)",AQRCGDQARGAKCPNCLCCGKYGFCGSGDAYCGAGSCQSQCRGC,"wheat, Triticum kiharae"
01470,"WAMP-1b (hevein-like peptide, natural AMPs; UCSS1a; plants;chitin-binding, BBS; 5S=S)",AQRCGDQARGAKCPNCLCCGKYGFCGSGDAYCGAGSCQSQCRGCR,"wheat, Triticum kiharae"
01508,"Ha-DEF1 (H. annuus defensin 1, natural AMPs; plants; BBMm; 4S=S; UCSS1a)",ELCEKASQTWSGTCGKTKHCDDQCKSWEGAAHGACHVRDGKHMCFCYFNC,"root, sunflower, Helianthus annuus"
01528,SIalpha1 (defensins; natural AMPs; plants; 4S=S; UCSS1a),RVCMKGSQHHSFPCISDRLCSNECVKEEGGWTAGYCHLRYCRCQKAC,"seeds, Sorghum bicolor"
01585,"Pp-AMP1 (P. pubescens AMP1; natural AMPs; 2S=S, UCSS1a;  plant defensin, plants)",KSCCRSTQARNIYNAPRFAGGSRPLCALGSGCKIVDDKKTPPND,"Japanese bamboo shoots, Phyllostachys pubescens"
01553,"PsDef1 (P. sylvestris defensin 1, natural AMPs; UCSS1a; 4S=S,  plants)",RMCKTPSGKFKGYCVNNTNCKNVCRTEGFPTGSCDFHVAGRKCYCYKPCP,"Seeds, Scots pine, Pinus sylvestris"
01586,"Pp-AMP2 (P. pubescens AMP2; natural AMPs; 3S=S, UCSS1a;  plant defensin, plants)",KSCCRSTTARNIYNGCRVPGTARPVCAKKSGCKIQEAKKCEPPYD,"Japanese bamboo shoots, Phyllostachys pubescens"
01584,"Ac-AMP1 (A. caudatus antimicrobial peptide 1, natural AMPs; UCSS1a; 3S=S, chitin-binding, plants; BBS)",VGECVRGRCPSGMCCSQFGYCGKGPKYCG,"Seeds, Amaranthus caudatus"
01588,"Fa-AMP2 (Fagopyrum antimicrobial peptide 2; natural AMPs; 4S=S, hevein-type, UCSS1a; plant defensin, plants)",AQCGAQGGGATCPGGLCCSQWGWCGSTPKYCGAGCQSNCR,"seeds, buckwheat, Fagopyrum esculentum Moench"
01587,"Fa-AMP1 (Fagopyrum antimicrobial peptide 1; natural AMPs; 4S=S, hevein-type, UCSS1a;  plant defensin, plants)",AQCGAQGGGATCPGGLCCSQWGWCGSTPKYCGAGCQSNCK,"seeds, buckwheat, Fagopyrum esculentum Moench"
01677,"PvD1 (P. vulgaris defensin 1, natural AMPs; plants; BBMm; BWQ? unclassified)",KTCENLADTYKGPCFTTGSCD,"seeds, Phaseolus vulgaris (cv. Pérola)"
01678,"Cc-LTP1 (Coffea canephora lipid transfer protein 1, natural AMPs; plants; BWQ, unclassified)",ITCQQVTSELGPCVPYLTGQGIP,"coffee seeds, Coffea canephora"
01683,SD2 (natural AMPs; defensins; UCSS1a;  plants; 4S=S),NEMGGPLVVEARTCESQSHKFKGTCLSDTNCANVCHSERFSGGKCRGFRRRCFCTTHC,"flowers, common sunflower, Helianthus annuus"
01685,"Rs-AFP4 (RsAFP4; R. sativus-antifungal protein 4, natural AMPs; defensins, XXQ, UCSS1a; 4S=S, plants)",QKLCERSSGTWSGVCGNNNACKNQCINLEGARHGSCNYIFPYHRCICY,"radish, Raphanus sativus"
01687,"Br-AFP1 (natural AMPs; defensins; plants; XXQ, UCSS1a;  4S=S)",QKLCERPSGTWSGVCGNNNACKNQCINLEGARHGSCNYVFPYHRCICYFPC,Brassica rapa subsp. chinensis
01684,"Rs-AFP3 (RsAFP3; R. sativus-antifungal protein 3, natural AMPs;  defensins, XXQ, UCSS1a;  plants; 4S=S)",KLCERSSGTWSGVCGNNNACKNQCIRLEGAQHGSCNYVFPAHKCICYFPC,"radish, Raphanus sativus"
01688,"Br-AFP2 (natural AMPs; defensins; plants; XXQ, UCSS1a; 4S=S)",QKLCERPSGTWSGVCGNNNACKNQCIR,Brassica rapa subsp. chinensis; Brassica napus
01689,"Sa-AFP1 (S alba antifungal peptide 1; natural AMPs; defensins; XXQ, UCSS1a;  plants; 4S=S)",QKLCERPSGTWSGVCGNNNACKNQCINLEKARHGSCNYVFPAHKCICYFPC,S alba
01693,"Ns-D1 (N. sativa defensin 1, natural AMPs; defensins, UCSS1a; 4S=S, plants)",KFCEKPSGTWSGVCGNSGACKDQCIRLEGAKHGSCNYKPPAHRCICYYEC,"seeds, Nigella sativa L."
01690,"Sa-AFP2 (S alba antifungal peptide 2; natural AMPs; defensins; XXQ, UCSS1a; plants; 4S=S)",QKLCQRPSGTWSGVCGNNNACKNQCINLEKARHGSCNYVFPAHKCICYFPC,S alba
01691,"Bn-AFP1 (B. napus antifungal peptide 1; natural AMPs; defensins; BWQ, XXQ, UCSS1a; plants)",QKLCERPSGTWSGVCGNNNACKNQCINLEK,Brassica napus
01692,"At-AFP1 (A thaliana antifungal peptide 1; natural AMPs; defensins; XXQ, UCSS1a; plants; 4S=S)",KLCERPSGTWSGVCGNSNACKNQCINLEKARHGSCNYVFPAHKCICYFPC,A thaliana
01686,PsD2 (P. sativum defensin 2; natural AMPs; defensins; UCSS1a; plants; 4S=S),KTCENLSGTFKGPCIPDGNCNKHCRNNEHLLSGRCRDDFRCWCTNRC,"pea seeds, Pisum sativum"
01714,JCpep7 (natural AMPs; plants),KVFLGLK,Jatropha curcas
01694,"Ns-D2 (N. sativa defensin 1, natural AMPs; defensins, UCSS1a; 4S=S, plants)",KFCEKPSGTWSGVCGNSGACKDQCIRLEGAKHGSCNYKLPAHRCICYYEC,"seeds, Nigella sativa L."
01760,EcAMP1 (E. crus-galli AMP 1; natural AMPs; hairpin-like peptides; 2S=S; plants),GSGRGSCRSQCMRRHEDEPWRVQECVSQCRRRRGGGD,"seeds, Echinochloa crus-galli"
01769,Piceain 1 (natural AMPs; plants; UCSS1a; 1S=S),KSLRPRCWIKIKFRCKSLKF,Picea sitchensis
01770,Piceain 2 (natural AMPs; plants; 1S=S),RPRCWIKIKFRCKSLKF,Picea sitchensis
01772,Sm-AMP-D1 (natural AMPs; S. media defensin 1; plants; 4S=S; UCSS1a),KICERASGTWKGICIHSNDCNNQCVKWENAGSGSCHYQFPNYMCFCYFDC,"seeds, common chickweed, Stellaria media L"
01773,Sm-AMP-D2 (natural AMPs; S. media defensin 2; plants; 4S=S; UCSS1a),KICERASGTWKGICIHSNDCNNQCVKWENAGSGSCHYQFPNYMCFCYFNC,"seeds, common chickweed, Stellaria media L"
01777,"Cliotide T4 (cT4; natural AMPs; cyclotides; XXC; 3S=S, UCBB1ab; Fabaceae, plants)",GIPCGESCVFIPCITAAIGCSCKSKVCYRN,Clitoria ternatea
01774,"Cliotide T1 (cT1; natural AMPs; cyclotides; XXC; 3S=S, UCBB1ab; Fabaceae, plants; Other possible AMPs? Cliotide T5,  Cliotide T6,  Cliotide T8,  Cliotide T9,  Cliotide T11)",GIPCGESCVFIPCITGAIGCSCKSKVCYRN,Clitoria ternatea
01775,"Cliotide T2 (cT2; natural AMPs; cyclotides; XXC; 3S=S, UCBB1ab; Fabaceae, plants; Others: cT5,  cT6,  cT7,  cT8,  cT9,  cT10,  cT11,  cT12)",GEFLKCGESCVQGECYTPGCSCDWPICKKN,Clitoria ternatea
01776,"Cliotide T3 (cT3; natural AMPs; cyclotides; XXC; 3S=S, UCBB1ab; Fabaceae, plants)",GLPTCGETCTLGTCYVPDCSCSWPICMKN,Clitoria ternatea
01785,"Vaby D (natural AMPs; cyclotides; plants; 3S=S; XXC, UCBB1ab;)",GLPVCGETCFGGTCNTPGCTCDPWPVCTRN,"Africa, the Ethiopian highlands, Viola abyssinica"
01803,"Tn-AFP (Trapa natans antifungal peptide, natural AMPs; plants)",LMCTHPLDCSN,"fruits, Trapa natans"
01805,"Cr-ACP1 (C. revoluta anticancer peptide 1, natural AMPs; plants)",AWKLFDDGV,"seeds, Cycas revoluta"
01806,"Viba 15 (natural AMPs; cyclotides; plants; 3S=S, UCBB1ab; XXC)",GLPVCGETCVGGTCNTPGCACSWPVCTRN,Viola philippica
01784,"Vaby A (natural AMPs; cyclotides; plants; 3S=S, UCBB1ab; XXC; other AMPs?: Vaby B; VabyC; and VabyE)",GLPVCGETCAGGTCNTPGCSCSWPICTRN,"Africa, the Ethiopian highlands, Viola abyssinica"
01808,"Viphi A (natural AMPs; cyclotides; plants; 3S=S, UCBB1ab; XXC)",GSIPCGESCVFIPCISSVIGCACKSKVCYKN,Viola philippica
01807,"Viba17  (natural AMPs; cyclotides; plants; 3S=S, UCBB1ab; XXC)",GLPVCGETCVGGTCNTPGCGCSWPVCTRN,Viola philippica
01809,"Viphi D (natural AMPs; cyclotides; plants; 3S=S, UCBB1ab; XXC)",GIPCGESCVFIPCISSVIGCSCSSKVCYRN,Viola philippica
01810,"Viphi E (natural AMPs; cyclotides; plants; 3S=S, UCBB1ab; XXC)",GSIPCGESCVFIPCISAVIGCSCSNKVCYKN,Viola philippica
01811,"Viphi F (natural AMPs; cyclotides; plants; 3S=S, UCBB1ab; XXC)",GSIPCGESCVFIPCISAIIGCSCSSKVCYKN,Viola philippica
01812,"Viphi G (natural AMPs; cyclotides; plants; 3S=S, UCBB1ab; XXC)",GSIPCEGSCVFIPCISAIIGCSCSNKVCYKN,Viola philippica
01813,"Mram 8 (natural AMPs; cyclotides; plants; 3S=S, UCBB1ab; XXC)",GIPCGESCVFIPCLTSAIDCSCKSKVCYRN,Viola philippica
01816,Ac-AFP1 (H. coronopifolia antifungal peptide 1; natural AMPs; UCSS1a; plants; 4S=S),RYCERSSGTWSGVCGNSGKCSNQCQRLEGAAHGSCNYVFPAHKCICYYPC,"Heliophila coronopifolia, South Africa"
01817,Ac-AFP2 (H. coronopifolia antifungal peptide 1; natural AMPs; UCSS1a; plants; 4S=S),QKLCERPSGTWSGVCGNNNACRNQCINLEKARHGSCNYVFPAHKCICYFPC,"Heliophila coronopifolia, South Africa"
01818,"Ac-AFP3 (H. coronopifolia antifungal peptide 1; natural AMPs; UCSS1a; 4S=S, plants)",RYCERSSGTWSGVCGNTDKCSSQCQRLEGAAHGSCNYVFPAHKCICYYPC,"Heliophila coronopifolia, South Africa"
01819,"Ac-AFP4 (H. coronopifolia antifungal peptide 1; natural AMPs; UCSS1a; 4S=S, plants)",QKLCERPSGTWSGVCGNNGACRNQCIRLERARHGSCNYVFPAHKCICYFPC,"Heliophila coronopifolia, South Africa"
01915,"Parigidin-br1 (natural AMPs; XXC; 3S=S, UCBB1ab; cyclotides; plants; ZZI)",GGSVPCGESCVFIPCITSLAGCSCKNKVCYYD,Palicourea rigida (Rubiaceae)
01916,"Hedyotide B1 (natural AMPs; XXC; 3S=S, UCBB1ab; cyclotides; plants; inactive: hedyotide B2)",GTRCGETCFVLPCWSAKFGCYCQKGFCYRN,Hedyotis biflora
01979,"ToAMP1 (natural AMPs; UCSS1a; 3S=S, plants)",VAKCTEESGGKYFVFCCYKPTRICYMNEQKCESTCIGK,dandelion Taraxacum officinale Wigg. flowers
01981,"ToAMP2 (natural AMPs; UCSS1a; 3S=S, plants)",GGKCTVDWGGQGGGRRLPSPLFCCYKPTRICYLNQETCETETCP,dandelion Taraxacum officinale Wigg. flowers
01982,"ToAMP3 (natural AMPs; UCSS1a; 4S=S, plants)",ANKCIIDCMKVKTTCGDECKGAGFKTGGCALPPDIMKCCHNC,dandelion Taraxacum officinale Wigg. flowers
01983,"Psyle A (natural AMPs; cyclotides; plants; 3S=S, UCBB1ab; XXC. Other AMPs? psyle B, D, F )",GIACGESCVFLGCFIPGCSCKSKVCYFN,Psychotria leptothyrsa
01985,"Psyle C (natural AMPs; uncyclo-tides; UCSS1a; 3S=S, plants)",KLCGETCFKFKCYTPGCSCSYPFCK,Psychotria leptothyrsa
01984,"Psyle E (natural AMPs; cyclotides; plants; 3S=S, UCBB1ab; XXC)",GVIPCGESCVFIPCISSVLGCSCKNKVCYRD,Psychotria leptothyrsa
01986,"ChaC1 (chassatide C1, natural AMPs; cyclotides; plants; 3S=S, UCBB1ab; More AMPs? chaC3, chaC5, chaC6, chaC9, chaC12-18)",GDACGETCFTGICFTAGCSCNPWPTCTRN,hybrid peptide of melittin and protamine.
01987,"ChaC2 (chassatide C2, natural AMPs; cyclotides; plants; 3S=S, UCBB1ab; XXC; Variants: chaC2A, XXO)",GIPCAESCVWIPPCTITALMGCSCKNNVCYNN,Chassalia chartacea (or Chassalia curviflora)
01988,"ChaC4 (chassatide C4, natural AMPs; cyclotides; plants; 3S=S, UCBB1ab; XXC)",GASCGETCFTGICFTAGCSCNPWPTCTRN,Chassalia chartacea (or Chassalia curviflora)
01989,"ChaC7 (chassatide C7, natural AMPs; uncyclo-tides; UCSS1a; 3S=S, plants)",IPCGESCVWIPCITAIAGCSCKNKVCYT,Chassalia chartacea (or Chassalia curviflora)
01990,"ChaC8 (chassatide C8, natural AMPs; uncyclo-tides; UCSS1a; 3S=S, plants)",AIPCGESCVWIPCISTVIGCSCSNKVCYR,Chassalia chartacea (or Chassalia curviflora)
01991,"ChaC10 (chassatide C10, natural AMPs; cyclotides; plants; 3S=S, UCBB1ab; XXC)",GEYCGESCYLIPCFTPGCYCVSRQCVNKN,Chassalia chartacea (or Chassalia curviflora)
02023,"Sd1 (sugarcane defensin 1; natural AMPs; defensins; UCSS1a; 4S=S, plants. More AMPs? Sd2, Sd4, Sd6)",RYCLSQSHRFKGLCMSSSNCANVCQTENFPGGECKADGATRKCFCKKIC,"Sugarcane, Saccharum officinarum"
01992,"ChaC11 (chassatide C11, natural AMPs; uncyclo-tides; UCSS1a; 3S=S, plants. Variants: chaC11A, XXO)",IPCGESCVWIPCISGMFGCSCKDKVCYS,Chassalia chartacea (or Chassalia curviflora)
02018,"Sd5 (sugarcane defensin 5; natural AMPs; defensins; UCSS1a; 4S=S, plants)",HTPTPTPICKSRSHEYKGRCIQDMDCNAACVKESESYTGGFCNGRPPFKQCFCTKPCKRERAAATLRWPGL,"Sugarcane, Saccharum officinarum"
02024,"Sd3 (sugarcane defensin 3; natural AMPs; defensins; UCSS1a; 4S=S, plants)",RHRHCFSQSHKFVGACLRESNCENVCKTEGFPSGECKWHGIVSKCHCKRIC,"Sugarcane, Saccharum officinarum"
02033,"LTP110 (lipid transfer protein, natural AMPs; plants; 4S=S; UCSS1a)",VSCGDVTSSIAPCLSYVMGRESSPSSSCCSGVRTLNGKASSSADRRTACSCLKNMASSFRNLNMGNAASIPSKCGVSVAFPISTSVDCSKIN,"rice leaves, Oryza sativa Indica Group"
02036,MiAMP2c (natural AMPs; plants; UCSS1a),RQRDPQQQYEQCQKHCQRRETEPRHMQTCQQRCERRYEKEKRKQQKRYEEQQREDEEKYEERMKEEDN,"cotton seeds, Macadamia integrifolia"
02034,"Coconut antifungal peptide (natural AMPs; plants; BWQ, unclassified)",EQCREEEDDR,Cocos nucifera
02035,"MiAMP2b (Macadamia integrifolia antimicrobial peptide 2b, natural AMPs;  plants; UCSS1a; Inactive: MiAMP2a)",DPQTECQQCQRRCRQQESGPRQQQYCQRRCKEICEEEEEYN,"cotton seeds, Macadamia integrifolia"
02037,MiAMP2d (natural AMPs; plants; UCSS1a),KRDPQQREYEDCRRRCEQQEPRQQHQCQLRCREQQRQHGRGGDMMNPQRGGSGRYEEGEEEQS,"cotton seeds, Macadamia integrifolia"
02042,"EcAMP2 (E. crus-galli AMP 2; natural AMPs; hairpin-like, 2S=S; plants; UCSS1; Derivatives: EcAMP2.1)",DRCSQQCQHHRDPDRKQQCMRECRRHQGRSD,"seeds, Echinochloa crusgalli L."
02051,"EcLTP (E. crus-galli lipid transfer protein; natural AMPs;  plants; BWQ, unclassified)",AISCGQVSSAIGPCLSYARGQGSAPSAGCC,"seeds, Echinochloa crusgalli L."
02041,Beta-purothionin (beta-PTH; natural AMPs; UCSS1a; plants; 4S=S),KSCCKSTLGRNCYNLCRARGAQKLCANVCRCKLTSGLSCPKDFPK,"wheat, Triticum aestivum"
02040,Alpha-purothionin (alpha1-PTH; natural AMPs; UCSS1a; plants; 4S=S),KSCCRSTLGRNCYNLCRARGAQKLCAGVCRCKISSGLSCPKGFPK,"wheat, Triticum aestivum"
02065,Datucin (natural AMPs; glycopeptide; plants; XXGn;  XXK),TFPKCAPTRPPGPKPCDINNFKSKFWHIWRA,"Datura stramonium, India, Asia"
02066,"Pm-AMP1 (P. monticola AMP1, natural AMPs; UCSS1a; 3S=S, pines, plants)",SYFSAWAGPGCNNHNARYSKCGCSNIGHNVHGGYEFVYQGQTAAAYNTDNCKGVAQTRFSSSVNQACSNFGWKSVFIQC,"western white pine (WWP), Pinus monitcola"
02173,"Panitide L2 (natural AMPs; XXQ, UCSS1a; 3S=S, plants; Others Panitide L1, Panitide L3; Panitide L4, Panitide L5, Panitide L6, Panitide L7, Panitide L8, Panitide L9, probably inactive MIC>20 uM)",QLPICGETCVLGGCYTPNCRCQYPICVR,Panicum laxum
02183,Cc-GRP (natural AMPs; plants; BWQ; unclassified),GNEGGGHGGHGGYGGYHHHGGGGGGYGGYHGGGGS,"seeds, Coffea canephora"
02236,ToAMP4 (natural AMPs; UCSS1a; plants; 3S=S),GYGDGCYSEDDLSVCCKKKFKVIGKCFKSVRECQNSGCKYH,"flowers, Taraxacum officinale"
02244,PaSn (UCSS1a; P. americana snakin; natural AMPs; plants; 6S=S),FQSHSLPTPADERNLLQQIDCGTSCSARCRLSSRPRLCKRACGTCCARCNCVPSGTAGNLDECPCYANMTTHGNKRKCP,"avocado seed, Persea americana var. drymifolia"
02325,"Cliotide T7 (CT7; Cter R; natural AMPs; cyclotides; XXC; 3S=S, UCBB1ab; Fabaceae, plants)",GIPCGESCVFIPCTVTALLGCSCKDKVCYKN,Clitoria ternatea
02326,"Cliotide T10 (CT10; Cter B; natural AMPs; cyclotides; XXC; 3S=S, UCBB1ab; Fabaceae, plants)",GVPCAESCVWIPCTVTALLGCSCKDKVCYLN,Clitoria ternatea
02258,Snakin-Z (natural AMPs; plants),CARLNCVPKGTSGNTETCPCYASLHSCRKYG,"fruits, Zizyphus jujuba"
02329,Lunasin (natural AMPs; plants),SKWQHQQDSCRKQLQGVNLTPCEKHIMEKIQGRGDDDDDDDDD,Glycine max
02340,"Cyclosaplin (natural AMPs; cyclic peptides; plants; XXC, UCBB1aA)",RLGDGCTR,"somatic seedlings,  Santalum album L."
02327,"Cliotide T12 (CT12; natural AMPs; cyclotides; XXC; 3S=S, UCBB1ab; Fabaceae, plants)",GIPCGESCVYIPCTVTALLGCSCKDKVCYKN,Clitoria ternatea
02332,PaDef (P. americana defensin; natural AMPs; plants; UCSS1a; 4S=S),CETPSKHFNGLCIRSSNCASVCHGEHFTDGRCQGVRRRCMCLKPC,"Avocado Fruit, Persea americana var. drymifolia"
02342,Potamin-1 (PT-1; natural AMPs; plants),DICTNCCAGTKGCNTTSANGAFICEGQSDPKKPKACPLNCDPHIAYA,"potato, Solanum tuberosum L cv. Gogu"
02341,"Peptide-G2 (PG-2, natural AMPs; plants; BWQ, unclassified)",LVKDNPLDISPKQVQALCTDLVIRCMCCC,"potato, Sanum tuberosum L cv. Gogu Valley"
02377,Tk-AMP-X2 (natural AMPs; alpha-hairpinin structural family; plants),ADDRCERMCQRYHDRREKKQCMKGCRYG,"wheat, Triticum kiharae Dorof. et Migush"
02405,Plantaricin CS (natural AMPs;  plants),GGYKNFYGSALRKGFYEGEAGRAIRR,"Coriander extract, Chinese parsley, Coriandrum sativum"
02328,"Cliotide T19 (CT19; natural AMPs; cyclotides; XXC; 3S=S, UCBB1ab; Fabaceae, plants)",GSVIKCGESCLLGKCYTPGCTCSRPICKKD,Clitoria ternatea
02428,"MtDef4 (M. Truncatula defensin 4, natural AMPs; UCSS1a; 4S=S, plants)",RTCESQSHKFKGPCASDHNCASVCQTERFSGGRCRGFRRRCFCTTHC,"barrel Clover seeds, Medicago Truncatula"
02407,Hispidalin (natural AMPs; medicinal plants),SDYLNNNPLFPRYDIGNVELSTAYRSFANQKAPGRLNQNWALTADYTYR,"Seeds, winter melon, Benincasa hispida"
02422,"Lc-def (L. culinaris defensin, natural AMPs; dimer, UCSS1a; 4S=S, plants; BBMm)",KTCENLSDSFKGPCIPDGNCNKHCKEKEHLLSGRCRDDFRCWCTRNC,lentil  Lens culinaris
02436,"MsSN-1 (MsSN1; Alfalfa snakin-1, natural AMPs; plants; UCSS1a; 6S=S)",GTDSGRFCSSICGQRCSKAGMKDRCMKFCGICCGKCKCVPSGTYGNKHECPCYRDMKNSKGKPKCP,"the “Queen of Forages”, Medicago sativa"
02496,ARACIN1 (natural AMPs; plants),GSCGASIAEFNSSQILAKRAPPCRRPRLQNSEDVTHTTLP,Arabidopsis thaliana
02497,ARACIN2 (natural AMPs; plants),GSCGAPISKYDFQVLAKRPPPCRRPRLENTEDVTHTTRP,Arabidopsis thaliana
02522,"AhPDF1.1 (natural AMPs; defensin, plants; XXQ; 4S=S; UCSS1a)",QRLCEKPSGTWSGVCGNNGACRNQCIRLEKARHGSCNYVFPAHKCICYFPC,"intracellular compartments, Arabidopsis halleri"
02477,EcAMP3 (E. crus-galli AMP 3; Arg-rich; natural AMPs; hairpin-like peptides; 2S=S; plants; UCSS1a),GADRCRERCERRHRGDWQGKQRCLMECRRREQEED,"barnyard grass seeds, Echinochloa crusgalli L."
02523,"PSI-1.2 (S3 fraction, Proteinase inhibitor, natural AMPs; plants; 4S=S; UCSS1a)",KACPRNCDTDIAYMVCPSSGERIIRKVCTNCCAAQKGCKLFRSNGSIKCTGT,"seeds, Bell pepper, Capsicum annuum"
02532,"Flo (Moringa oleifera cationic protein, MOCP; natural AMPs; plants; XXQ)",QGPGRQPDFQRCGQQLRNISPPQRCPSLRQAVQLTHQQQGQVGPQQVRQMYRVASNIPST,seeds; Moringa oleifera Lam
02559,"Tk-AMP-X1 (natural AMPs; plants; 2S=S, UCSS1a)",TDDRCERMCQHYHDRREKKQCMKGCRYGESD,"wheat,  Triticum kiharae Dorof. et Migush"
02571,"Cycloviolacin VY1 (natural AMPs; cyclotides, plants; XXC; 3S=S; UCBB1ab)",CGESCVFIPCITTVLGCSCSIKVCYKNGSIP,Viola yedoensis
02601,BnPRP1 (natural AMPs; Pro-rich peptide; plants; UCLL1a),PPIQNPSMAPPTQNPYGQPMTPPTQNPYGQPMAPP,Brassica napus
02585,"SmAMP3 (natural AMPs; Gly-rich; chitin-binding,  plants; 3S=S, UCSS1a)",VGPGGECGGRFGGCAGGQCCSRFGFCGSGPKYCAH,"leaves, weed,  Stellaria media L."
02627,"Ep-AMP1 (E. pachanoi AMP 1;  natural AMPs; cystine knot Peptide, 3S=S; UCSS1a; BBMm; plants)",CVLIGQRCDNDRGPRCCSGQGNCVPLPFLGGVCAV,Echinopsis pachanoi
02657,"Vigno 5 (natural AMPs; cyclotides, plants; 3S=S, XXC; UCBB1ab; more AMPs? Vigno 1-4, 6-10)",GLPLCGETCVGGTCNTPGCSCGWPVCVRN,Viola ignobilis
02658,"Psysol 2 (natural AMPs; cyclotides, plants; 3S=S, XXC; UCBB1ab)",GLPICGESCVGGTCNTPGCTCTWPVCTRN,Psychotria solitudinum
02628,"Jaburetox-2Ec (jbtx; a fragment of canatoxin, a urease isoform; natural AMPs; plants; pepcanatox; UCLL1a)",MGPVNEANCKAAMEIVCRREFGHKEEEDASEGVTTGDPDCPFTKAIPREEYANKYGPTIGDKIRLGDTDLIAEIEKDFALYGDESVFGGGKVI,Canavalia ensiformis
02660,"DC2 (natural AMPs; dissusa cyclotide 2, plants; 3S=S, XXC; UCBB1ab)",GAVPCGETCVYLPCITPDIGCSCQNKVCYRD,Hedyotis diffusa
02659,"DC1 (natural AMPs; dissusa cyclotide 1, natural AMPs; plants; 3S=S, XXC; UCBB1ab)",GAFLKCGESCVYLPCLTTVVGCSCQNSVCYRD,Hedyotis diffusa
02661,"DC3 (dissusa cyclotide 3, natural AMPs; plants; 3S=S, XXC; UCBB1ab)",GTSCGETCVLLPCLSSVLGCTCQNKRCYKD,Hedyotis diffusa
02674,"MB1533 (natural AMPs; defensin; 3s=s, UCSS1A; plants)",ATTAMSRPGQIMTTRDMNIECRGNGWVGRGARDCCSGRCRVLKSKRCKCIGNKPSF,"Intracellular Meristem Endophyte, Scots Pine, Methylobacterium extorquens  DSM13060"
02685,"Cliotide 15 (cT15, natural AMPs; cyclotides, plants; XXC, 3S=S, UCBB1ab)",GLPICGETCFKTKCYTKGCSCSYPVCKRN,"the Butterfly Pea, Clitoria ternatea"
02686,"Cliotide 16 (cT16, natural AMPs; cyclotides, plants; XXC, 3S=S, UCBB1ab)",GSVIGCGETCLRGRCYTPGCTCDHGICKKN,"the Butterfly Pea, Clitoria ternatea"
02687,"Cliotide 20 (cT20, natural AMPs; cyclotides, plants; XXC, 3S=S, UCBB1ab)",GSAIRCGESCLLGKCYTPGCTCDRPICKKN,"the Butterfly Pea, Clitoria ternatea"
02707,Tomato Snakin-2 (natural AMPs; plants; 6S=S; UCSS1a),DSYKKIDCGGACAARCRLSSRPRLCHRACGTCCARCNCVPPGTSGNTETCPCYASLTTHGNKRKCP,Solanum lycopersicum
02736,"AtPDF2.3 (natural AMPs; flowering plants; UCSS1a, 4S=S)",RTCESKSHRFKGPCVSTHNCANVCHNEGFGGGKCRGFRRRCYCTRHC,Arabidopsis thaliana
02769,"Cc-LTP2 (Coffea canephora lipid transfer protein 2, plants; BWQ, unclassified)",ITCQQVTAELEPCVPYLTQGIP,"seeds, Coffea canephora Pierre"
02737,Labaditin (Lo; natural AMPs; plants; XXC; UCBB1aA),VWTVWGTIAG,
02772,Thionin-like peptide 1 (plants; 4S=S; UCSS1a),KEICCKVPTTPFLCTNDPQCKTLCSKVNYEDGHCFDILSKCVCMNRCVQDAKTLAAELIEEEFLKQ,"Fruits, Capsicum annuum"
02773,CaThi (thionin-like peptide 2; plants; 4S=S; UCSS1a),KEICCKELTKPVKCSSDPLCQKLCMEKEKYEDGHCFTILSKCLCMKRCNAKTLATELLA,"Fruits, Capsicum annuum"
02787,NCR247 (nodule-specific Cys-containing peptide; Arg-rich; natural AMPs; plants; BBMm; UCSS1a),RNGCIVDPRCPYQQCRRPLYCRRR,"symbiont bacteria, Medicago truncatula"
02771,"Dm-AMP2 (Dahlia defensin, plants; BWQ, unclassified)",EVCEKASKTWSGNCGNTGHC,"seeds, Dahlia merckii"
02788,"NCR335 (nodule-specific Cys-containing peptides; natural AMPs; plants; BBMm,UCSS1a)",RLNTTFRPLNFKMLRFWGQNRNIMKHRGQKVHFSLILSDCKTNKDCPKLRRANVRCRKSYCVPI,"symbiont bacteria, Medicago truncatula"
02853,"OsDEF8 (dimer; natural AMPs; plants, 4S=S, UCSS1a)",RTCESQSHRFKGPCARKANCASVCNTEGFPDGYCHGVRRRCMCTKPCP,"rice, Oryza sativa L"
02852,"OsDEF7 (OsAFP1; dimer; natural AMPs; plants, 4S=S, UCSS1a; BBII)",RHCLSQSHRFKGMCVSSNNCANVCRTESFPDGECKSHGLERKCFCKKVC,"rice, Oryza sativa L"
02987,Brucin (natural AMPs; plants),HTLCMDGGATY,"fruits, Brucea javanica"
03019,Ps-AFP1 (P. sativum antifungal peptide 1; natural AMPs; plants; 2S=S; UCSS1a),RQLKSSRRGALVCVRLKLCSAILSRGLSCGMFSCNARR,"peas radicle, Pisum sativum"
03055,Beta-astratide bM1 (natural AMPs; defensin; 4S=S; UCSS1a; Chinese medicinal plants),CEKPSKFFSGPCIGSSGKTQCAYLCRRGEGLQDGNCKGLKCVCAC,"Huang Qi, Astragalus membranaceus"
03056,MCh-AMP1 (M. chamomilla AMP 1; natural AMPs; medicinal plants; UCLL1a),LSVKAFTGIQLRGVCGIEVKARG,Matricaria chamomilla L.
03072,"ZmD32 (Z. mays defensin, natural AMPs; plants; 4S=S; UCSS1a)",RTCQSQSHRFRGPCLRRSNCANVCRTEGFPGGRCRGFRRRCFCTTHC,"Corn, Zea mays"
03082,"Skh-AMP1 (natural AMPs; plants, UCLL1)",GRTSKQELCTWERGSVRQADKTIAG,"leaves, Satureja khuzistanica"
03083,"aM1 (natural AMPs; plants, 3S=S; UCSS1a)",VDCSGACSPFEVPPCGSRDCRCIPIGLVVGFCIYPTG,"Huang Qi, Astragalus membranaceus"
03113,"Cter E (natural AMPs; cyclotides; XXC; 3S=S, UCBB1ab; plants)",GIPCAESCVWIPCTVTALLGCSCKDKVCYLD,Clitoria ternatea
03114,"Cter G (natural AMPs; cyclotides; XXC; 3S=S, UCBB1ab;  plants)",GLPCGESCVFIPCITTVVGCSCKNKVCYNN,Clitoria ternatea
03130,"Atr-AMP1 (natural AMPs; Pro-rich; medicinal plants, 1S=S; UCSS1a; XXO; XXK3)",MLCPSYRRCPRVPP,Amaranthus tricolor
