APD ID,Name,Sequence,Source
00003,"Hs-AFP1 (HsAFP1, H. sanguinea antifungal protein 1; defensins; natural AMPs; 4S=S; UCSS1a; BBS; BBMm_lipid?; plants)",DGVKLCDVPSGTWSGHCGSSSKCSQQCKDREHFAYGGACHYQFPSVKCFCKRQC,Heuchera sanguinea
00237,Phoratoxin (natural AMPs; UCSS1a; 3S=S; plants),KSCCPTTTARNIYNTCRFGGGSRPVCAKLSGCKIISGTKCDSGWNH,California mistletoe  Phoradendron tomentosum subsp. macrophyllum (Loranthaceae)
00203,"Mj-AMP1 (MjAMP1, natural AMPs; knottin-type peptide; Jalapa defensin; UCSS1a;   3S=S; plants)",QCIGNGGRCNENVGPPYCCSGFCLRQPGQGYGYCKNR,Garden four-o'clock Mirabilis jalapa
00194,"Ac-AMP2 (A. caudatus antimicrobial peptide 2, natural AMPs; UCSS1a; 3S=S, chitin-binding, plants; BBS)",VGECVRGRCPSGMCCSQFGYCGKGPKYCGR,"seeds, Amaranthus caudatus"
00103,"NmDef02 (defensins; natural AMPs; 3S=S, UCSS1a; plants)",RECKAQGRHGTCFRDANCVQVCEKQAGWSHGDCRAQFKCKCIFEC,Nicotiana megalosiphon
00270,"Pn-AMP1 (PnAMP1, natural AMPs; Hevein-like; UCSS1a; 4S=S; chitin-binding; plants; BBS)",QQCGRQASGRLCGNRLCCSQWGYCGSTASYCGAGCQSQCRS,"Japanese morning glory, Pharbitis nil"
00236,"Pyrularia thionin (Pp-TH, Pp-defensin? natural AMPs; UCSS1a; 4S=S; plants)",KSCCRNTWARNCYNVCRLPGTISREICAKKCDCKIISGTTCPSDYPK,"nuts, Pyrularia pubera"
00184,"MBP-1 (Maize Basic Peptide 1; Arg-rich; natural AMPs; hairpin-like peptides; plants; 2S=S, UCSS1a)",RSGRGECRRQCLRRHEGQPWETQECMRRCRRRG,"Maize, Zea mays L."
00286,"Rs-AFP1 (RsAFP1, Raphanus sativus-antigungal protein 1, natural AMPs; defensin; XXQ, UCSS1a; 4S=S, plants)",QKLCERPSGTWSGVCGNNNACKNQCINLEKARHGSCNYVFPAHKCICYFPC,"Radish seeds, Raphanus sativus , Brassicaceae species"
00274,"Circulin A (CirA, natural AMPs; XXC: cyclotides;  3S=S; UCBB1aB; plants; ZZHp)",GIPCGESCVWIPCISAALGCSCKNKVCYRN,Chassalia parviflora
00282,Cyclopsychotride A (CPT; natural AMPs; XXC; cyclotides; UCBB1aB; 3S=S; plants),SIPCGESCVFIPCTVTALLGCSCKSKVCYKN,Psychotria longipes
00275,"Circulin B (CirB, natural AMPs; XXC; cyclotides; UCBB1aB; plants; ZZHp; 3S=S)",GVIPCGESCVFIPCISTLLGCSCKNKVCYRN,Chassalia parviflora
00004,"Ct-AMP1 (CtAMP1, C. ternatea-antimicrobial peptide 1; defensins; natural AMPs; 4S=S, UCSS1a; plants)",NLCERASLTWTGNCGNTGHCDTQCRNWESAKHGACHKRGNWKCFCYFDC,Clitoria ternatea
00202,"Mj-AMP2 (MjAMP2, natural AMPs; knottin-type peptide; UCSS1a;  3S=S; plants)",CIGNGGRCNENVGPPYCCSGFCLRQPNQGYGVCRNR,Garden four-o'clock Mirabilis jalapa
00287,"Rs-AFP2 (RsAFP2, Raphanus sativus-antigungal protein 2, natural AMPs; plant defensin, UCSS1a; XXQ, 4S=S; BBMm_GlcCerMOA; plants)",QKLCQRPSGTWSGVCGNNNACKNQCIRLEKARHGSCNYVFPAHKCICYFPC,"radish seeds, Raphanus sativus, Brassicaceae species"
00288,"So-D1 (S. oleracea defensin 1; natural AMPs; spinach, plants; BWQ; unclassified)",TCESPSHKFKGPCATNRNCES,"Leaves and stems, Spinacia oleracea"
00289,"So-D3 (S. oleracea defensin 3; natural AMPs; BWQ? UCSS1a; spinach, plants)",GIFSSRKCKTVSKTFRGICTRNANC,"Leaves and stems, Spinacia oleracea"
00290,"So-D4 (S. oleracea defensin 4; natural AMPs; BWQ? UCSS1a; spinach, plants)",MFFSSKKCKTVSKTFRGPCVRNA,"Leaves and stems, Spinacia oleracea"
00291,"So-D5 (S. oleracea defensin 5; natural AMPs; BWQ? UCSS1a; spinach, plants)",MFFSSKKCKTVSKTFRGPCVRNAN,"Leaves and stems, Spinacia oleracea"
00292,"So-D7 (S. oleracea defensin 7; natural AMPs; 2S=S?, UCSS1a; spinach, plants)",GIFSSRKCKTPSKTFKGYCTRDSNCDTSCRYEGYPAGD,"Leaves and stems, Spinacia oleracea"
00296,"Fabatin-1 (4S=S;  natural AMPs; defensins, UCSS1a; plants)",LLGRCKVKSNRFHGPCLTDTHCSTVCRGEGYKGGDCHGLRRRCMCLC,"Broad bean, Vicia faba"
00402,"VrD2 (Vigna radiata defensin 2, natural AMPs; 4S=S, UCSS1a;  plant defensin, mung bean; plants)",KTCENLANTYRGPCFTTGSCDDHCKNKEHLRSGRCRDDFRCWCTRNC,Vigna radiata
00297,Fabatin-2 (natural AMPs; 4S=S; defensins; UCSS1a;  plants),LLGRCKVKSNRFNGPCLTDTHCSTVCRGEGYKGGDCHGLRRRCMCLC,"Broad bean, Vicia faba"
00342,"Mc-AMP1 (M. crystallinum Antimicrobial peptide 1, natural AMPs; knottin-type peptide, plants; 2S=S; UCSS1a)",AKCIKNGKGCREDQGPPFCCSGFCYRQVGWARGYCKNR,"Common ice plant, Mesembryanthemum crystallinum"
00355,Ginkbilobin (Bai Guo; natural AMPs; plants; BWQ; unclassified),ANTAFVSSAHNTQKIPAGAPFNRNLRAMLADLRQNAAFAG,"seeds, Ginkgo biloba,  Asia"
00428,"MiAMP1 (M. integrifolia  antimicrobial peptide 1, natural AMPs; UCSS1a; plants; 3S=S)",SAFTVWSGPGCNNRAERYSKCGCSAIHQKGGYDFSYTGQTAALYNQAGCSGVAHTRFGSSARACNPFGWKSIFIQC,"Macadamia nut, Macadamia integrifolia"
00436,"Ah-AMP1 (A. hippocastanum antimicrobial peptide 1, natural AMPs; defensin; UCSS1a; 3S=S; plants)",LCNERPSQTWSGNCGNTAHCDKQCQDWEKASHGACHKRENHWKCFCYFNC,"Horse chestnuts, Aesculus hippocastanum"
00483,PsD1 (Pisum sativvm defensin 1; natural AMPs; UCSS1a; plants; 4S=S),KTCEHLADTYRGVCFTNASCDDHCKNKAHLISGTCHNWKCFCTQNC,"Pea seeds, Pisum sativvm"
00446,"Alpha-basrubrin (Fragment, natural AMPs; plants)",GADFQECMKEHSQKQHQHQG,"edible Chinese vegetable, Malabar spinach"
00479,"Antifungal protein 1 (PAFP-S; Pa-AMP-1, PaAMP-1, Pa-AMP1; natural AMPs; knottin-type peptide; defensins; C6 type, UCSS1a; plants; 3S=S)",AGCIKNGGRCNASAGPPYCCSSYCFQIAGQSYGVCKNR,"pokeweed seeds, Phytolacca americana"
00495,"Pseudo-hevein (natural AMPs; 4S=S, UCSS1a; Minor hevein, hevein-like peptides; plants)",EQCGRQAGGKLCPNNLCCSQYGWCGSSDDYCSPSKNCQSNCKGGG,Para rubber tree
00511,Shepherin I (natural AMPs; Gly-rich; His-rich; plants),GYGGHGGHGGHGGHGGHGGHGHGGGGHG,"roots, shepherd's purse, Capsella bursa-pastoris"
00512,Shepherin II (natural AMPs; Gly-rich; plants),GYHGGHGGHGGGYNGGGGHGGHGGGYNGGGHHGGGGHG,"roots, shepherd's purse, Capsella bursa-pastoris"
00532,"Lunatusin (natural AMPs; plants, ZZHp, BWQ; unclassified)",KTCENLADTFRGPCFATSNC,Phaseolus lunatus L. (lima bean)
00518,"Ib-AMP3 (Ib antimicrobial peptide 3, natural AMPs; UCSS1a; 2S=S, plants, XXQ)",QYRHRCCAWGPGRKYCKRWC,"seeds, Impatiens balsamina (Ib)"
00519,"Ib-AMP4  (Ib antimicrobial peptide 4, Arg-rich; natural AMPs; UCSS1a; 2S=S, plants, XXQ, BBMm; Derivatives made for SeqAR)",QWGRRCCGWGPGRRYCRRWC,"seeds, Impatiens balsamina (Ib)"
00550,"Tu-AMP 1 (TuAMP1, natural AMPs; thionin-like antimicrobial peptides, plants, tulip; 4S=S; UCSS1a)",KSCCRNTVARNCYNVCRIPGTPRPVCAATCDCKLITGTKCPPGYEK,"Albtulip, Tulipa gesneriana L."
00553,"Sesquin (natural AMPs; defensins, plants, ZZHp; BWQ, unclassified)",KTCENLADTY,"Seeds, Vigna sesquipedalis, ground bean"
00715,VaD1 (natural AMPs; defensins; plants; 4S=S; UCSS1a),RTCMKKEGWGKCLIDTTCAHSCKNRGYIGGNCKGMTRTCYCLVNC,"Seeds, Vigna angularis Kao Hsiung #6"
00560,"Dendrocin (natural AMPs; plants, bamboo; BWQ)",TTLTLHNLCPYPVWWLVTPNNGGFPIIDNTPVVLG,"bamboo shoots, Dendrocalamus latiflora Munro"
00534,"Tu-AMP 2 (TuAMP2, natural AMPs; thionin-like antimicrobial peptides, natural AMPs; 4S=S; UCSS2a; plants, tulip)",KSCCRNTTARNCYNVCRIPG,"tulip, Tulipa gesneriana L."
00716,VrD1 (V. radiata defensin 1; natural AMPs; 3S=S; UCSS1a; plants; ZZI),RTCMIKKEGWGKCLIDTTCAHSCKNRGYIGGNCKGMTRTCYCLVNC,"seeds, Vigna radiata"
00563,"White cloud bean defensin (Pv-defensin; natural AMPs; UCSS1a; 4S=S, plants)",KTCENLADTFRGPCFATSNCDDHCKNKEHLLSGRCRDDFRCWCTRNC,Phaseolus vulgaris cv. ‘white cloud bean’
00717,"PPT (defensins; UCSS1a; 3S=S, plants; DXWZ)",RTCESQSHRFHGTCVRESNCASVCQTEGFIGGNCRAFRRRCFCTRNC,"pistil, Petunia inflate"
00720,"P322 (defensins; natural AMPs; UCSS1a; 4S=S,  plants)",RHCESLSHRFKGPCTRDSNCASVCETERFSGGNCHGFRRRCFCTKPC,"tuber, potato, Solanum tuberosum"
00730,"Kalata B8 (natural AMPs; cyclotides, ZZHp; plants; 3S=S, UCBB1aB; XXC)",GSVLNCGETCLLGTCYTTGCTCNKYRVCTKD,"African herb, Oldenlandia affinis"
00729,Kalata B1 (KB1; XXC; natural AMPs; cyclotides; UCBB1aB; 3S=S; plants; ZZHp; ZZi; BBMm; BBBm; Derivatives: kalata B1 oia or nfk; XXO),GLPVCGETCVGGTCNTPGCTCSWPVCTRN,"African herb, Oldenlandia affinis"
00913,"Ib-AMP1 (IbAMP1, Ib antimicrobial peptide 1; natural AMPs; UCSS1a; 2S=S;  plants, XXQ)",QWGRRCCGWGPGRRYCVRWC,"seeds, Impatiens balsamina (Ib)"
00912,"Ar-AMP (ArAMP, A. retroflexus antimicrobial peptide, natural AMPs; hevein-like family; UCSS1a; 3S=S; plants)",AGECVQGRCPSGMCCSQFGYCGRGPKYCGR,Amaranthus retroflexus L.
00914,"Ib-AMP2 (IBAMP2,  Ib antimicrobial peptide 2; natural AMPs; UCSS1a; 2S=S; plants, XXQ)",QYGRRCCNWGPGRRYCKRWC,"seeds, Impatiens balsamina (Ib)"
00916,"Cryptdin-2 (Crp2, cryp02, natural AMPs; defensins, alpha; UCSS1a; mouse, rodents, mammals, animals; 3S=S)",LRDLVCYCRTRGCKRRERMNGTCRKGHLMYTLCCR,"small intestine, mice, Mus musculus"
00918,"Dm-AMP1 (DmAMP1, Dahlia defensin, C8 type; natural AMPs; 4s=s;  UCSS1a; BBMm_M(IP)2C; plants)",ELCEKASKTWSGNCGNTGHCDNQCKSWEGAAHGACHVRNGKHMCFCYFNC,"seeds, Dahlia merckii"
00915,Ee-CBP (E. europaeus chitin-binding protein; natural AMPs; a hevein-like peptide; 5s=s; UCSS1a; plants; BBS),QQCGRQAGNRRCANNLCCSQYGYCGRTNEYCCTSQGCQSQCRRCG,"spindle tree, Euonymus europaeus L. (Ee)"
00919,pSAS10 (natural AMPs; defensins; 4s=s; UCSS1a; plants),KTCENLVDTYRGPCFTTGSCDDHCKNKEHLLSGRCRDDVRCWCTRNC,"seeds, cowpea, Vigna unguiculata"
00917,"Pa-AMP2 (PaAMP2, defensins, C6 type; 3s=s; UCSS1a; plants; DXWZ)",ACIKNGGRCVASGGPPYCCSNYCLQIAGQSYGVCKKH,"pokeweed seeds, Phytolacca americana"
00920,pI230 (natural AMPs; defensins; 4s=s; UCSS1a; plants),NTCENLAGSYKGVCFGGCDRHCRTQEGAISGRCRDDFRCWCTKNC,"pod, pea, Pisum sativum"
00982,"PhD2 (P. hybrida defensin 2, natural AMPs; defensins; 5s=s; UCSS1a; plants)",GTCKAECPTWEGICINKAPCVKCCKAQPEKFTDGHCSKILRRCLCTKPC,"petals, Petunia hybrida"
00922,FST (defensins; natural AMPs; UCSS1a; plants; 4s=s),RECKTESNTFPGICITKPPCRKACISEKFTDGHCSKLLRRCLCTKPC,"flowers, Nicotiana tabacum"
00921,"SIalpha2 (SIa2, natural AMPs; defensins; 4s=s; UCSS1a; plants)",RVCMKGSAGFKGLCMRDQNCAQVCLQEGWGGGNCDGVMRQCKCIRQC,"seeds, Sorghum bicolor"
00978,"Ms-Def1 (MsDef1, M. sativa defensin 1, alfAFP, alf-AFP; alfalfa antifungal peptide, natural AMPs; defensins; UCSS1a; plants;  BBMm_GlcCerMOA; 4S=S)",RTCENLADKYRGPCFSGCDTHCTTKENAVSGRCRDDFRCWCTKRC,"alfalfa seeds, Medicago sativa"
00981,"PhD1 (P. hybrida defensin 1, natural AMPs; defensins; 5s=s; UCSS1a; plants)",ATCKAECPTWDSVCINKKPCVACCKKAKFSDGHCSKILRRCLCTKEC,"petals, Petunia hybrida"
00979,"NaD1 (N. alata defensin 1, Na-D1; natural AMPs; defensins; 4s=s; UCSS1a; ZZI; plants; BBBH2o)",RECKTESNTFPGICITKPPCRKACISEKFTDGHCSKILRRCLCTKPC,"ornamental tobacco flowers, Nicotiana alata"
00983,CcD1 (natural AMPs; defensins; 4s=s; UCSS1a; plants),QNNICKTTSKHFKGLCFADSKCRKVCIQEDKFEDGHCSKLQRKCLCTKNC,Capsicum chinense
00985,NeThio2  (natural AMPs; gamma-thionin; defensins; 4S=S; UCSS1a; plants),KDCKTESNTFPGICITKPPCRKACIKEKFTDGHCSKILRRCLCTKPC,Nicotiana excelsior
00984,TPP3  (natural AMPs; defensins; 4S=S; UCSS1a; plants; BBMm),QICKAPSQTFPGLCFMDSSCRKYCIKEKFTGGHCSKLQRKCLCTKPC,"tomato, Lycopersicon esculentum"
00986,NeThio1  (natural AMPs; defensins; 4S=S; UCSS1a; plants),KSTCKAESNTFPGLCITKPPCRKACLSEKFTDGKCSKILRRCICYKPC,Nicotiana paniculata
00990,"Pth-St1 (StPTH1, natural AMPs; defensins; UCSS1a; plants; BWQ, unclassified)",RNCESLSHRFKGPCTRDSN,"potato, Solanum tuberosum"
00989,VrCRP (natural AMPs; defensins;  4S=S; UCSS1a; plants; ZZI),RTCMIKKEGWGKCLIDTTCAHSCKNRGYIGGDCKGMTRTCYCLVNC,"a bruchid-resistant mungbean, V. radiata"
00992,"Snakin-2 (StSN2, natural AMPs; 6S=S,  UCSS1a; plants)",YSYKKIDCGGACAARCRLSSRPRLCNRACGTCCARCNCVPPGTSGNTETCPCYASLTTHGNKRKCP,"potato, Solanum tuberosum cv Jaerla"
00991,"Snakin-1 (StSN1, natural AMPs; snakin; 6S=S; UCSS1a; plants; BBS)",GSNFCDSKCKLRCSKAGLADRCLKYCGICCEECKCVPSGTYGNKHECPCYRDKKNSKGKSKCP,"potato, Solanum tuberosum"
00993,"So-D2 (S. oleracea defensin D2,  natural AMPs; defensins; 4S=S, UCSS1a; plants)",GIFSSRKCKTPSKTFKGICTRDSNCDTSCRYEGYPAGDCKGIRRRCMCSKPC,"leaf, Spinacia oleracea"
00994,"So-D6 (S. oleracea defensin D6, natural AMPs; defensins;  plants; BWQ; unclassified)",GIFSNMYARTPAGYFRGPAGYAAN,Spinacia oleracea
01023,"Cycloviolin B (natural AMPs; cyclotides; XXC, 3S=S, UCBB1aB; plants; ZZHp)",GTACGESCYVLPCFTVGCTCTSSQCFKN,Leonia cymosa
01024,"Cycloviolin C (natural AMPs; cyclotides; plants; XXC, 3S=S, UCBB1aB; ZZHp)",GIPCGESCVFIPCLTTVAGCSCKNKVCYRN,Leonia cymosa
01022,"Cycloviolin A (cyclotides; natural AMPs; plants; XXC, 3S=S, UCBB1aB; ZZHp)",GVIPCGESCVFIPCISAAIGCSCKNKVCYRN,Leonia cymosa
01026,"Varv peptide A (Varv A, kalata S; natural AMPs; cyclotides; plants; XXC; 3S=S, UCBB1aB)",GLPVCGETCVGGTCNTPGCSCSWPVCTRN,"Viola arvensis,Viola odorata, Viola tricolor, Viola baoshanensis, Viola yedoensis, and Viola biflora"
01025,"Cycloviolin D (natural AMPs; cyclotides; plants; XXC, 3S=S, UCBB1aB; ZZHp)",GFPCGESCVFIPCISAAIGCSCKNKVCYRN,Leonia cymosa
01028,"Varv peptide C (Varv C, cyclotides; plants; XXC; 3S=S, UCBB1aB; DXWZ)",GVPICGETCVGGTCNTPGCSCSWPVCTRN,Viola arvensis
01027,"Varv peptide B (Varv B, cyclotides; plants; XXC; 3S=S, UCBB1aB;  DXWZ)",GLPVCGETCFGGTCNTPGCSCDPWPMCSRN,Viola arvensis
01029,"Varv peptide D (Varv D, cyclotides; Leu-rich; plants; XXC; 3S=S, UCBB1aB;  DXWZ)",GLPICGETCVGGSCNTPGCSCSWPVCTRN,Viola arvensis
01033,"Varv peptide H (Varv H, cyclotides; plants; XXC; 3S=S, UCBB1aB; DXWZ)",GLPVCGETCFGGTCNTPGCSCETWPVCSRN,Viola arvensis
01030,"Varv peptide E (Varv E,  Cycloviolacin O12; natural AMPs; cyclotides; plants; XXC, 3S=S, UCBB1aB; ZZHp)",GLPICGETCVGGTCNTPGCSCSWPVCTRN,Viola arvensis
01031,"Varv peptide F (Varv F, natural AMPs; cyclotides; plants; XXC; 3S=S, UCBB1aB;  plants)",GVPICGETCTLGTCYTAGCSCSWPVCTRN,Viola arvensis
01032,"Varv peptide G (Varv G,  cyclotides; plants; XXC; 3S=S, UCBB1aB; DXWZ)",GVPVCGETCFGGTCNTPGCSCDPWPVCSRN,Viola arvensis
01034,"Palicourein (natural AMPs; cyclotides; plants; XXC; 3S=S, UCBB1aB; ZZHp)",GDPTFCGETCRVIPVCTYSAALGCTCDDRSDGLCKRN,Palicourea condensata
01035,"Cycloviolacin O1 (natural AMPs; cyclotides;  XXC, 3S=S, UCBB1aB; plants; ZZI)",GIPCAESCVYIPCTVTALLGCSCSNRVCYN,Viola odorata
01037,"Cycloviolacin O3 (CyO3; natural AMPs; cyclotides; plants; XXC; 3S=S, UCBB1aB;  ZZP)",GIPCGESCVWIPCLTSAIGCSCKSKVCYRN,Viola odorata
01036,"Cycloviolacin O2 (CyO2; natural AMPs; cyclotides; plants; XXC; 3S=S, UCBB1aB; ZZP)",GIPCGESCVWIPCISSAIGCSCKSKVCYRN,Viola odorata
01038,"Cycloviolacin O4 (cyclotides; plants; XXC; 3S=S, UCBB1aB; DXWZ)",GIPCGESCVWIPCISSAIGCSCKNKVCYRN,Viola odorata
01039,"Cycloviolacin O5 (cyclotides; plants; XXC; 3S=S, UCBB1aB;  DXWZ)",GTPCGESCVWIPCISSAVGCSCKNKVCYKN,Viola odorata
01040,"Cycloviolacin O6 (cyclotides; plants; XXC; 3S=S, UCBB1aB; DXWZ)",GTLPCGESCVWIPCISAVGCSCKSKVCYKN,Viola odorata
01041,"Cycloviolacin O7 (cyclotides; plants; XXC; 3S=S, UCBB1aB; DXWZ)",SIPCGESCVWIPCTITALAGCKCKSKVCYN,Viola odorata
01042,"Cycloviolacin O8 (natural AMPs; cyclotides; plants; XXC; 3S=S, UCBB1aB; ZZP)",GTLPCESCVWIPCISSVVGCSCKSKVCYKN,Viola odorata
01043,"Cycloviolacin O9 (cyclotides; plants; XXC; 3S=S, UCBB1aB; DXWZ)",GIPCGESCVWIPCLTSAVGCSCKSKVCYRN,Viola odorata
01046,"Cycloviolacin H1 (cyclotides; plants; XXC; 3S=S, UCBB1aB;  DXWZ)",GIPCGESCVYIPCLTSAIGCSCKSKVCYRN,Viola hederaceae
01044,"Cycloviolacin O10 (cyclotides; plants; XXC; 3S=S, UCBB1aB; DXWZ)",GIPCGESCVYIPCLTSAVGCSCKSKVCYRN,Viola odorata
01045,"Cycloviolacin O11 (cyclotides; plants; XXC; 3S=S, UCBB1aB;  DXWZ)",GTLPCGESCVWIPCISAVVGCSCKSKVCYKN,Viola odorata
01047,"Kalata B5 (natural AMPs; cyclotides; plants; XXC; 3S=S, UCBB1aB; ZZP)",TPCGESCVYIPCISGVIGCSCTDKVCYLN,"flowers, Viola betonicifolia"
01048,"DP7 (synthetic, UCLL1)",VQWRIRVAVIRK,Engineered
01049,"Kalata B2 (KB2; natural AMPs; cyclotides; plants; XXC;  3S=S, UCBB1aB; ZZI; ZZP; Derivatives: oxidized kalata B2 nfk or kyn; XXO)",GLPVCGETCFGGTCNTPGCSCTWPICTRD,Viola betonicifolia
01051,"Kalata B4 (cyclotides; plants; XXC; 3S=S, UCBB1aB; DXWZ)",GLPTCGETCFGGTCNTPGCTCDPWPICTRD,Viola betonicifolia
01050,"Kalata B3 (cyclotides; plants; XXC; 3S=S, UCBB1aB; DXWZ)",GLPTCGETCFGGTCNTPGCTCDPWPICTRD,Viola betonicifolia
01052,"Pn-AMP2 (PnAMP2, natural AMPs; hevein-like, UCSS1a; 4S=S, chitin-binding,  plants; BBS)",QQCGRQASGRLCGNRLCCSQWGYCGSTASYCGAGCQSQCR,"Japanese morning glory, Pharbitis nil"
01055,"Cycloviolacin H4 (natural AMPs; cyclotides; plants; XXC, 3S=S, UCBB1aB; )",GIPCAESCVWIPCTVTALLGCSCSNNVCYN,Austalian native violet Viola hederaceae
01056,"Cycloviolacin H2 (cyclotides; plants; XXC; 3S=S, UCBB1aB; DXWZ)",SAIACGESCVYIPCFIPGCSCRNRVCYLN,Viola hederaceae
01054,"Kalata B7 (kB7, natural AMPs; cyclotides; plants; XXC; 3S=S, UCBB1aB; ZZP; BBM)",GLPVCGETCTLGTCYTQGCTCSWPICKRN,Oldenlandia affinis
01057,"Cycloviolacin H3 (cyclotides; plants; XXC; 3S=S, UCBB1aB; DXWZ)",GLPVCGETCFGGTCNTPGCICDPWPVCTRN,Viola hederaceae
01053,"Kalata B6 (natural AMPs; cyclotides; plants; XXC; 3S=S, UCBB1aB; ZZP;  BBMm)",GLPVCGETCFGGTCNTPGCSCSSWPICTRN,"African plant, Oldenlandia affinis"
01060,"Circulin C (natural AMPs; cyclotides; plants; XXC, 3S=S, UCBB1ab; ZZHp)",GIPCGESCVFIPCITSVAGCSCKSKVCYRN,tropical tree Chassalia parvifolia
01058,"Vhl-1 (XXO, natural AMPs; cyclotides, macrocyclic knotted proteins; plants; XXC, 3S=S, UCBB1aB; ZZHp)",SISCGESCAMISFCFTEVIGCSCKNKVCYLN,Viola hederaceae
01059,"Vhl-2 (cyclotides; plants; XXC; 3S=S, UCBB1aB; DXWZ)",GLPVCGETCFTGTCYTNGCTCDPWPVCTRN,Viola hederaceae
01061,"Circulin D (natural AMPs; cyclotides; plants; XXC, 3S=S, UCBB1ab; ZZHp)",KIPCGESCVWIPCVTSIFNCKCKENKVCYHD,tropical tree Chassalia parvifolia
01062,"Circulin E (natural AMPs; cyclotides; plants; XXC, 3S=S, UCBB1ab; ZZHp)",KIPCGESCVWIPCLTSVFNCKCENKVCYHD,tropical tree Chassalia parvifolia
01066,"Cycloviolacin O24 (natural AMPs; cyclotides; plants; XXC, 3S=S, UCBB1ab;  ZZHp)",GLPTCGETCFGGTCNTPGCTCDPWPVCTHN,Viola odorata
01064,"Cycloviolacin O13 (natural AMPs; CyO13; cyclotides; plants; XXC, 3S=S, UCBB1ab; ZZHp, ZZP)",GIPCGESCVWIPCISAAIGCSCKSKVCYRN,Viola odorata
01065,"Cycloviolacin O14 (natural AMPs; cyclotides; plants; XXC, 3S=S, UCBB1ab;  ZZHp, ZZP)",GSIPACGESCFKGKCYTPGCSCSKYPLCAKN,Viola odorata
01063,"Circulin F (natural AMPs; cyclotides; plants; XXC, 3S=S, UCBB1ab; ZZHps)",KVCYRAIPCGESCVWIPCISAAIGCSCKN,tropical tree Chassalia parvifolia
01067,"Cycloviolacin O15 (natural AMPs; cyclotides; plants; XXC; 3S=S, UCBB1ab; ZZP)",GLVPCGETCFTGKCYTPGCSCSYPICKKN,Viola odorata
01068,"Cycloviolacin O16 (natural AMPs; cyclotides; plants; XXC; 3S=S, UCBB1ab; ZZP)",GLPCGETTCFTGKCYTPGCSCSYPICKKIN,Viola odorata
01069,"Cycloviolacin O17 (cyclotides; plants; XXC; 3S=S, UCBB1ab; DXWZ)",GIPCGESCVWIPGISAAIGCSCKNKVCYRN,Viola odorata
01070,"Cycloviolacin O18 (cyclotides; plants; XXC; 3S=S, UCBB1ab; DXWZ)",GIPCGESCVYIIPCTVTALAQCKCKSKVCYN,Viola odorata
01072,"Cycloviolacin O20 (cyclotides; plants; XXC; 3S=S, UCBB1ab; DXWZ)",GIPCGESCVWIPCLTSAIGCSCKSKVCYKD,Viola odorata
01071,"Cycloviolacin O19 (cyO19, cyclotides; plants; XXC; 3S=S, UCBB1ab; DXWZ)",GTLPCGESCVWIPCISSVVGCSCKSKVCYKD,Viola odorata
01073,"Cycloviolacin O21 (cyclotides; plants; XXC; 3S=S, UCBB1ab; DXWZ)",GLPVCGETCVTGSCYTPGCTCSWPVCTRN,Viola odorata
01074,"Cycloviolacin O22 (cyclotides; plants; XXC; 3S=S, UCBB1ab; DXWZ)",GLPICGETCVGGTCNTPGCTCSWPVCTRN,Viola odorata
01075,"Cycloviolacin O23 (cyclotides; plants; XXC; 3S=S, UCBB1ab; DXWZ)",GLPTCGETCFGGTCNTPGCTCDSSWPICTHN,Viola odorata
01077,"Cycloviolacin Y1 (natural AMPs; cyclotides; plants; XXC, 3S=S, UCBB1ab; ZZHp)",GGTIFDCGETCFLGTCYTPGCSCGNYGFCYGTN,Chinese herb Viola yedoensis  and Viola odorata
01078,"Cycloviolacin Y2 (cyclotides; plants; XXC; 3S=S, UCBB1ab; DXWZ)",GGTIFDCGESCFLGTCYTAGCSCGNWGLCYGTN,Chinese herb Viola yedoensis
01076,"Cycloviolacin O25 (cyclotides; plants; XXC; 3S=S, UCBB1ab; DXWZ)",DIFCGETCAFIPCITHVPGTCSCKSKVCYFN,Viola odorata
01079,"Cycloviolacin Y3 (cyclotides; plants; XXC; 3S=S, UCBB1ab; DXWZ)",GGTIFDCGETCFLGTCYTAGCSCGNWGLCYGTN,Chinese herb Viola yedoensis
01080,"Cycloviolacin Y4 (natural AMPs; cyclotides; plants; XXC, 3S=S, UCBB1ab; ZZHp)",GVPCGESCVFIPCITGVIGCSCSSNVCYLN,Chinese herb Viola yedoensis
01081,"Cycloviolacin Y5 (natural AMPs; cyclotides; plants; XXC, 3S=S, UCBB1ab;  ZZHp)",GIPCAESCVWIPCTVTALVGCSCSDKVCYN,Chinese herb Viola yedoensis
01083,"Hyfl B (cyclotides; plants; XXC; 3S=S, UCBB1ab; DXWZ)",GSPIQCAETCFIGKCYTEELGCTCTAFLCMKN,Australian Hybanthus floribundus E
01082,"Hyfl A (cyclotides; plants; XXC; 3S=S, UCBB1ab; DXWZ)",SISCGESCVYIPCTVTALVGCTCKDKVCYLN,Australian Hybanthus floribundus E
01088,"Hyfl G (plant cyclotides; plants; XXC, BWQ; 3S=S, UCBB1ab; DXWZ)",CAETCVVLPCFIVPGCSCKSSVCYFN,Australian Hybanthus floribundus E
01084,"Hyfl C (cyclotides; plants; XXC; 3S=S, UCBB1ab; DXWZ)",GSPRQCAETCFIGKCYTEELGCTCTAFLCMKN,Australian Hybanthus floribundus E
01085,"Hyfl D (cyclotides; plants; XXC; 3S=S, UCBB1ab; DXWZ)",GSVPCGESCVYIPCFTGIAGCSCKSKVCYYN,Australian Hybanthus floribundus E
01086,"Hyfl E (cyclotides; plants; XXC; 3S=S, UCBB1ab; DXWZ)",GEIPCGESCVYLPCFLPNCYCRNHVCYLN,Australian Hybanthus floribundus E
01087,"Hyfl F (plant cyclotides; plants; XXC; 3S=S, UCBB1ab; DXWZ)",SISCGETCTTFNCWIPNCKCNHHDKVCYWN,Australian Hybanthus floribundus E
01089,"Hyfl H (cyclotides; plants; XXC, 3S=S, UCBB1ab; BWQ; DXWZ)",CAETCIYIPCFTEAVGCKCKDKVCYKN,Australian Hybanthus floribundus E
01090,"Hyfl I (cyclotides; plants; XXC; 3S=S, UCBB1ab; DXWZ)",GIPCGESCVFIPCISGVIGCSCKSKVCYRN,Australian Hybanthus floribundus W
01091,"Hyfl J (cyclotides; plants; XXC; 3S=S, UCBB1ab; DXWZ)",GIACGESCAYFGCWIPGCSCRNKVCYFN,Australian Hybanthus floribundus W
01092,"Hyfl K (cyclotides; plants; XXC; 3S=S, UCBB1ab; DXWZ)",GTPCGESCVYIPCFTAVVGCTCKDKVCYLN,Australian Hybanthus floribundus W
01093,"Hyfl L (cyclotides; plants; XXC; 3S=S, UCBB1ab; DXWZ)",GTPCAESCVYLPCFTGVIGCTCKDKVCYLN,Australian Hybanthus floribundus W
01094,"Hyfl M (cyclotides; plants; XXC; 3S=S, UCBB1ab; DXWZ)",GNIPCGESCIFFPCFNPGCSCKDNLCYYN,Australian Hybanthus floribundus W
01096,"Hyfl O (cyclotides; plants; XXC, 3S=S, UCBB1ab; BWQ; DXWZ)",CGETCVIFPCISAAFGCSCKDTVCYKN,Australian Hybanthus floribundus W
01095,"Hyfl N (cyclotides; plants; XXC, BWQ; 3S=S, UCBB1ab; DXWZ)",CGETCVILPCISAALGCSCKDTVCYKN,Australian Hybanthus floribundus W
01097,"Hyfl P (cyclotides; plants; XXC, 3S=S, UCBB1ab; BWQ; DXWZ)",CVWIPCISGIAGCSCKNKVCYLN,Australian Hybanthus floribundus W
01098,"Hymo A (cyclotides; plants; XXC, 3S=S, UCBB1ab; BWQ; DXWZ)",CGETCLFIPCIFSVVGCSCSSKVCYRN,Australian Hybanthus monopetalus
01099,"Hymo B (cyclotides; plants; XXC, 3S=S, UCBB1ab; BWQ; DXWZ)",CGETCVTGTCYTPGCACDWPVCKRD,Australian Hybanthus  monopetalus
01101,"Hyve A (cyclotides; plants; XXC, 3S=S, UCBB1ab;  BWQ; DXWZ)",RGCYKICGETCLFIPCLTSVFGCSCKN,Australian Hybanthus vernonii
01100,"Hyst A (cyclotides; plants; XXC, 3S=S, UCBB1ab; BWQ; DXWZ)",CGETCIWGRCYSENIGCHCGFGICTLN,Australian Hybanthusstellarioides
01102,"Hyca A (cyclotides; plants; XXC, 3S=S, UCBB1ab; BWQ; DXWZ)",CGETCVVDTRCYTKKCSCAWPVCMRN,Australian Hybanthus calycinus
01103,"Hyde A (cyclotides; plants; XXC, ?3S=S, UCBB1ab; BWQ; DXWZ)",CVWIPCISAAIGCSCKSKVCYRN,Australian Hybanthus debilissimus
01104,"Hyen A (cyclotides; plants; XXC, 3S=S, UCBB1ab; BWQ; DXWZ)",CGESCVYIPCTVTALLGCSCKDKVCYKN,Australian Hybanthus enneaspermus
01105,"Hyen B (cyclotides; plants; XXC, 3S=S, UCBB1ab; BWQ; DXWZ)",CGETCKVTKRCSGQGCSCLKGRSCYD,Australian Hybanthus enneaspermus
01106,"Hyep A (cyclotides; plants; XXC, 3S=S, UCBB1ab; BWQ; DXWZ)",CGETCVVLPCFIVPGCSCKSSVCYFN,Australian Hybanthus epacroides
01109,"kalata B10 (kB10, cyclotides; plants; XXC; 3S=S, UCBB1ab; DXWZ; Variants: kalata B10 linear, uncyclo-tides; kalata B10 oia, XXO)",GLPTCGETCFGGTCNTPGCSCSSWPICTRD,African plant Oldenlandia affinis DC (Rubiaceae)
01108,"kalata B9 (kB9, natural AMPs; cyclotides; plants; XXC, 3S=S, UCBB1ab; DXWZ. Variant: kalata B9 linear, uncyclo-tides)",GSVFNCGETCVLGTCYTPGCTCNTYRVCTKD,"African plant,  Oldenlandia affinis DC (Rubiaceae)"
01110,"kalata B11 (kB11, cyclotides; plants; XXC; 3S=S, UCBB1ab; DXWZ)",GLPVCGETCFGGTCNTPGCSCTDPICTRD,African plant Oldenlandia affinis DC (Rubiaceae)
01111,"kalata B12 (kB12, cyclotides; plants; XXC; 3S=S, UCBB1ab; DXWZ)",GSLCGDTCFVLGCNDSSCSCNYPICVKD,African plant Oldenlandia affinis DC (Rubiaceae)
01107,"Hyep B (cyclotides; plants; XXC, 3S=S, UCBB1ab; BWQ; DXWZ)",CGETCIYIPCFTEAVGCKCKDKVCYKN,Australian Hybanthus epacroides
01113,"kalata B14 (cyclotides; plants; XXC; 3S=S, UCBB1ab; DXWZ)",GLPVCGESCFGGTCNTPGCACDPWPVCTRD,African plant Oldenlandia affinis DC (Rubiaceae)
01114,"kalata B15 (cyclotides; plants; XXC; 3S=S, UCBB1ab; DXWZ)",GLPVCGESCFGGSCYTPGCSCTWPICTRD,African plant Oldenlandia affinis DC (Rubiaceae)
01112,"kalata B13 (kB13; cyclotides; plants; XXC; 3S=S, UCBB1ab; DXWZ)",GLPVCGETCFGGTCNTPGCACDPWPVCTRD,African plant Oldenlandia affinis DC (Rubiaceae)
01115,"kalata B16 (cyclotides; plants; XXC; 3S=S, UCBB1ab; DXWZ)",GIPCAESCVYIPCTITALLGCKCQDKVCYD,African plant Oldenlandia affinis DC (Rubiaceae)
01116,"kalata B17 (cyclotides; plants; XXC; 3S=S, UCBB1ab; DXWZ)",GIPCAESCVYIPCTITALLGCKCKDQVCYN,African plant Oldenlandia affinis DC (Rubiaceae)
01117,"Vibi A (plant cyclotides; plants; XXC; 3S=S, UCBB1ab; DXWZ)",GLPVCGETCFGGTCNTPGCSCSYPICTRN,alpine violet Viola biflora
01118,"Vibi B (cyclotides; plants; XXC; 3S=S, UCBB1ab; DXWZ)",GLPVCGETCFGGTCNTPGCTCSYPICTRN,alpine violet Viola biflora
01119,"Vibi C (cyclotides; plants; XXC; 3S=S, UCBB1ab; DXWZ)",GLPVCGETCAFGSCYTPGCSCSWPVCTRN,alpine violet Viola biflora
01120,"Vibi D (cyclotides; plants; XXC; 3S=S, UCBB1ab; DXWZ)",GLPVCGETCFGGRCNTPGCTCSYPICTRN,alpine violet Viola biflora
01121,"Vibi E (natural AMPs; cyclotides; plants; 3S=S, UCBB1ab; XXC)",GIPCAESCVWIPCTVTALIGCGCSNKVCYN,alpine violet Viola biflora
01123,"Vibi G (natural AMPs; cyclotides; plants;3S=S, UCBB1ab;  XXC)",GTFPCGESCVFIPCLTSAIGCSCKSKVCYKN,alpine violet Viola biflora
01122,"Vibi F (cyclotides; plants; XXC; 3S=S, UCBB1ab; DXWZ)",GTIPCGESCVFIPCLTSALGCSCKSKVCYKN,alpine violet Viola biflora
01124,"Vibi H (natural AMPs; cyclotides; plants; 3S=S, UCBB1ab; XXC)",GLLPCAESCVYIPCLTTVIGCSCKSKVCYKN,alpine violet Viola biflora
01125,"Vibi I (cyclotides; plants; XXC; 3S=S, UCBB1ab; DXWZ)",GIPCGESCVWIPCLTSTVGCSCKSKVCYRN,alpine violet Viola biflora
01126,"Vibi J (cyclotides; plants; XXC; 3S=S, UCBB1ab; DXWZ)",GTFPCGESCVWIPCISKVIGCACKSKVCYKN,alpine violet Viola biflora
01133,"PL-101 (analog of plicatamide, Synthetic, UCLL1; XXA; Derivative: PL-102)",FFHLHFHY,Designed
01132,"GKY25 (synthetic, UCLL1; BBL)",GKYGFYTHVFRLKKWIQKVIDQFGE,in human wound fluid and fibrin
01127,"Vibi K (cyclotides; plants; XXC; 3S=S, UCBB1ab; DXWZ)",GIPCGESCVWIPCLTSAVGCPCKSKVCYRN,alpine violet Viola biflora
